{"$schema":"https://json-schema.org/draft/2020-12/schema","$id":"https://schemas.rotprods.dev/clever/v1/memory.schema.json","type":"object","additionalProperties":false,"required":["contractVersion","memoryId","kind","owner","accessScope","classification","retention","content","confidence","createdAt","nativeOwnerRuntime"],"properties":{"contractVersion":{"$ref":"https://schemas.rotprods.dev/clever/v1/common.schema.json#/$defs/contractVersion"},"memoryId":{"type":"string","minLength":1},"kind":{"type":"string","enum":["MEMORY_KIND_WORKING","MEMORY_KIND_EPISODIC","MEMORY_KIND_SEMANTIC","MEMORY_KIND_PROCEDURAL","MEMORY_KIND_PROFILE","MEMORY_KIND_EVIDENCE"]},"owner":{"$ref":"https://schemas.rotprods.dev/clever/v1/common.schema.json#/$defs/principalRef"},"accessScope":{"type":"string","minLength":1},"classification":{"$ref":"https://schemas.rotprods.dev/clever/v1/common.schema.json#/$defs/classification"},"retention":{"type":"string","enum":["RETENTION_CLASS_TRANSIENT","RETENTION_CLASS_SESSION","RETENTION_CLASS_USER_MANAGED","RETENTION_CLASS_DURABLE"]},"content":{"$ref":"https://schemas.rotprods.dev/clever/v1/common.schema.json#/$defs/payload"},"confidence":{"type":"number","minimum":0,"maximum":1},"createdAt":{"$ref":"https://schemas.rotprods.dev/clever/v1/common.schema.json#/$defs/timestamp"},"derivedAt":{"$ref":"https://schemas.rotprods.dev/clever/v1/common.schema.json#/$defs/timestamp"},"provenance":{"type":"array","items":{"$ref":"https://schemas.rotprods.dev/clever/v1/common.schema.json#/$defs/provenanceRef"}},"evidence":{"type":"array","items":{"$ref":"https://schemas.rotprods.dev/clever/v1/common.schema.json#/$defs/evidenceRef"}},"nativeOwnerRuntime":{"type":"string","minLength":1},"migrationState":{"type":"string"}}}
