{"contractVersion":{"major":1,"minor":0},"memoryId":"mem_demo","kind":"MEMORY_KIND_EPISODIC","owner":{"userId":"user_demo"},"accessScope":"user:user_demo","classification":"DATA_CLASSIFICATION_SENSITIVE","retention":"RETENTION_CLASS_USER_MANAGED","content":{"schemaUri":"clever://memory/episode/v1","contentType":"application/json","data":"e30="},"confidence":0.9,"createdAt":"2026-09-01T00:00:00Z","provenance":[{"sourceRepo":"BasedHardware/omi","sourceCommit":"e1eca38ff28758d58cde43045691c8ba479063e9"}],"nativeOwnerRuntime":"omi","migrationState":"NATIVE_AUTHORITATIVE"}
